<?xml version="1.0" encoding="UTF-8"?>
<npc
    controller="com.l2jserver.model.world.npc.controller.MonsterController"
    id="25556" xsi:schemaLocation="npc ../../npc.xsd"
    xsi:noNamespaceSchemaLocation="npc" xmlns:xsi="http://www.w3.org/2001/XMLSchema-instance">
    <info aggressive="false" targetable="true" attackable="true">
        <name display="true" send="false">Brutus' Left Hand</name>
        <level>77</level>
        <race>UNDEAD</race>
        <sex>MALE</sex>
        <stats>
            <hp regen="8.5" max="28567.687256316"/>
            <mp regen="3.0" max="4722.0"/>
            <attack critical="4" evasion="0" range="40">
                <physical speed="253.0" damage="2569.32168"/>
                <magical speed="333.0" damage="584.83789"/>
            </attack>
            <defense>
                <physical value="328.27073"/>
                <magical value="240.21427"/>
            </defense>
            <move walk="27.0" run="170.0"/>
            <base wit="20" dex="30" men="20" con="43" str="40" int="21"/>
        </stats>
        <experience>0</experience>
        <sp>0</sp>
        <item lefthand="0" righthand="142"/>
        <collision heigth="31.0" radius="12.0"/>
    </info>
    <skills>
        <skill level="1" id="4045"/>
        <skill level="1" id="4408"/>
        <skill level="1" id="4409"/>
        <skill level="11" id="4410"/>
        <skill level="11" id="4411"/>
        <skill level="11" id="4412"/>
        <skill level="11" id="4413"/>
        <skill level="2" id="4414"/>
        <skill level="3" id="4415"/>
        <skill level="1" id="4416"/>
        <skill level="1" id="5465"/>
    </skills>
</npc>
