<?xml version="1.0" encoding="UTF-8"?>
<template:npc
    controller="com.l2jserver.model.world.npc.controller.impl.MonsterController"
    id="27119" xsi:schemaLocation="http://schemas.l2jserver2.com/npc ../../npc.xsd"
    xmlns:xsi="http://www.w3.org/2001/XMLSchema-instance" xmlns:template="http://schemas.l2jserver2.com/npc">
    <info aggressive="false" targetable="true" attackable="true">
        <name display="true" send="false">Spirit of Sir Herod</name>
        <title send="false">Quest Monster</title>
        <level>35</level>
        <race>UNDEAD</race>
        <sex>MALE</sex>
        <stats>
            <hp regen="4.5" max="772.73802"/>
            <mp regen="1.8" max="402.6"/>
            <attack critical="4" evasion="0" range="40">
                <physical speed="253.0" damage="129.32896"/>
                <magical speed="333.0" damage="88.31491"/>
            </attack>
            <defense>
                <physical value="136.72948"/>
                <magical value="100.0527"/>
            </defense>
            <move walk="80.0" run="120.0"/>
            <base wit="20" dex="30" men="20" con="43" str="40" int="21"/>
        </stats>
        <experience>0</experience>
        <sp>0</sp>
        <item lefthand="0" righthand="69"/>
        <collision heigth="28.5" radius="11.0"/>
    </info>
    <skills>
        <skill level="2" id="4037"/>
        <skill level="1" id="4408"/>
        <skill level="1" id="4409"/>
        <skill level="11" id="4410"/>
        <skill level="11" id="4411"/>
        <skill level="11" id="4412"/>
        <skill level="11" id="4413"/>
        <skill level="2" id="4414"/>
        <skill level="3" id="4415"/>
        <skill level="1" id="4416"/>
    </skills>
</template:npc>
